### ISSUE TITLE
Issue with cluster ip's not being reachable for pods after meshnet initialization

### ISSUE THREAD

**Issue by mhines01** [google/kne#43]
Starting meshnetd daemon
time="2021-09-11T22:52:25Z" level=info msg="Trying in-cluster configuration"
time="2021-09-11T22:52:25Z" level=info msg="Starting meshnet daemon..."
time="2021-09-11T22:52:25Z" level=info msg="GRPC server has started on port: 51111"
time="2021-09-11T22:55:38Z" level=info msg="Retrieving bar's metadata from K8s..."
time="2021-09-11T22:55:38Z" level=info msg="Reading pod bar from K8s"
time="2021-09-11T22:55:38Z" level=error msg="Failed to read pod bar from K8s"
time="2021-09-11T22:55:38Z" level=error msg="finished unary call with code Unknown" error="topologies.networkop.co.uk \"bar\" not found" grpc.code=Unknown grpc.method=Get grpc.service=meshnet.v1beta1.Local grpc.start_time="2021-09-11T22:55:38Z" grpc.time_ms=5.82 peer.address="[::1]:33110" span.kind=server system=grpc
time="2021-09-11T22:55:38Z" level=info msg="[transport] transport: loopyWriter.run returning. connection error: desc = \"transport is closing\"" system=system
time="2021-09-11T22:55:51Z" level=info msg="Retrieving bar's metadata from K8s..."
time="2021-09-11T22:55:51Z" level=info msg="Reading pod bar from K8s"
time="2021-09-11T22:55:51Z" level=error msg="Failed to read pod bar from K8s"
time="2021-09-11T22:55:51Z" level=error msg="finished unary call with code Unknown" error="topologies.networkop.co.uk \"bar\" not found" grpc.code=Unknown grpc.method=Get grpc.service=meshnet.v1beta1.Local grpc.start_time="2021-09-11T22:55:51Z" grpc.time_ms=2.693 peer.address="[::1]:33230" span.kind=server system=grpc
time="2021-09-11T22:55:51Z" level=info msg="[transport] transport: loopyWriter.run returning. connection error: desc = \"transport is closing\"" system=system
time="2021-09-11T22:58:20Z" level=info msg="Retrieving vm-1's metadata from K8s..."
time="2021-09-11T22:58:20Z" level=info msg="Reading pod vm-1 from K8s"
time="2021-09-11T22:58:20Z" level=info msg="finished unary call with code OK" grpc.code=OK grpc.method=Get grpc.service=meshnet.v1beta1.Local grpc.start_time="2021-09-11T22:58:20Z" grpc.time_ms=5.426 peer.address="[::1]:34388" span.kind=server system=grpc
time="2021-09-11T22:58:20Z" level=info msg="Setting vm-1's SrcIp=172.18.0.2 and NetNs=/var/run/netns/cni-f825ebc5-2799-5e50-d6ee-4181b13b71f4"
time="2021-09-11T22:58:20Z" level=info msg="Reading pod vm-1 from K8s"
time="2021-09-11T22:58:20Z" level=info msg="Update pod status vm-1 from K8s"

**Comment by mhines01** [comment]
this causes problems for controllers which start after meshnet is running - this stops them from being able to connect to the expected cluster ip for the kube api server

pod started before meshnet
root@foo:/# kubectl get pods
NAME   READY   STATUS    RESTARTS   AGE
bar    1/1     Running   0          6m49s
foo    1/1     Running   0          17m
root@foo:/# telnet 10.96.0.1 443
Trying 10.96.0.1...
Connected to 10.96.0.1.
Escape character is '^]'.
^]
telnet> quit
Connection closed.
root@foo:/# telnet 10.96.0.1 443
Trying 10.96.0.1...
Connected to 10.96.0.1.
Escape character is '^]'.
GET
Connection closed by foreign host.
root@foo:/# 

pod started after meshnet
root@bar:/# telnet 10.96.0.1 443
Trying 10.96.0.1...
telnet: Unable to connect to remote host: No route to host
root@bar:/# 


Node firewall
root@kne-control-plane:/opt/cni/bin# iptables -t nat -L -n -v
Chain PREROUTING (policy ACCEPT 43 packets, 2604 bytes)
 pkts bytes target     prot opt in     out     source               destination         
 2170 99528 KUBE-SERVICES  all  --  *      *       0.0.0.0/0            0.0.0.0/0            /* kubernetes service portals */
 2107 95724 DOCKER_OUTPUT  all  --  *      *       0.0.0.0/0            192.168.65.2        

Chain INPUT (policy ACCEPT 2153 packets, 98413 bytes)
 pkts bytes target     prot opt in     out     source               destination         

Chain OUTPUT (policy ACCEPT 5124 packets, 277K bytes)
 pkts bytes target     prot opt in     out     source               destination         
 5303  289K KUBE-SERVICES  all  --  *      *       0.0.0.0/0            0.0.0.0/0            /* kubernetes service portals */
  151  9806 DOCKER_OUTPUT  all  --  *      *       0.0.0.0/0            192.168.65.2        

Chain POSTROUTING (policy ACCEPT 2946 packets, 178K bytes)
 pkts bytes target     prot opt in     out     source               destination         
 5452  298K KUBE-POSTROUTING  all  --  *      *       0.0.0.0/0            0.0.0.0/0            /* kubernetes postrouting rules */
    0     0 DOCKER_POSTROUTING  all  --  *      *       0.0.0.0/0            192.168.65.2        
 2934  146K KIND-MASQ-AGENT  all  --  *      *       0.0.0.0/0            0.0.0.0/0            ADDRTYPE match dst-type !LOCAL /* kind-masq-agent: ensure nat POSTROUTING directs all non-LOCAL destination traffic to our custom KIND-MASQ-AGENT chain */

Chain DOCKER_OUTPUT (2 references)
 pkts bytes target     prot opt in     out     source               destination         
    0     0 DNAT       tcp  --  *      *       0.0.0.0/0            192.168.65.2         tcp dpt:53 to:127.0.0.11:39517
 2258  106K DNAT       udp  --  *      *       0.0.0.0/0            192.168.65.2         udp dpt:53 to:127.0.0.11:52190

Chain DOCKER_POSTROUTING (1 references)
 pkts bytes target     prot opt in     out     source               destination         
    0     0 SNAT       tcp  --  *      *       127.0.0.11           0.0.0.0/0            tcp spt:39517 to:192.168.65.2:53
    0     0 SNAT       udp  --  *      *       127.0.0.11           0.0.0.0/0            udp spt:52190 to:192.168.65.2:53

Chain KIND-MASQ-AGENT (1 references)
 pkts bytes target     prot opt in     out     source               destination         
  602 36120 RETURN     all  --  *      *       0.0.0.0/0            10.244.0.0/16        /* kind-masq-agent: local traffic is not subject to MASQUERADE */
 2332  110K MASQUERADE  all  --  *      *       0.0.0.0/0            0.0.0.0/0            /* kind-masq-agent: outbound traffic is subject to MASQUERADE (must be last in chain) */

Chain KUBE-KUBELET-CANARY (0 references)
 pkts bytes target     prot opt in     out     source               destination         

Chain KUBE-MARK-DROP (0 references)
 pkts bytes target     prot opt in     out     source               destination         
    0     0 MARK       all  --  *      *       0.0.0.0/0            0.0.0.0/0            MARK or 0x8000

Chain KUBE-MARK-MASQ (11 references)
 pkts bytes target     prot opt in     out     source               destination         
    4   240 MARK       all  --  *      *       0.0.0.0/0            0.0.0.0/0            MARK or 0x4000

Chain KUBE-NODEPORTS (1 references)
 pkts bytes target     prot opt in     out     source               destination         

Chain KUBE-POSTROUTING (1 references)
 pkts bytes target     prot opt in     out     source               destination         
 5276  287K RETURN     all  --  *      *       0.0.0.0/0            0.0.0.0/0            mark match ! 0x4000/0x4000
    2   120 MARK       all  --  *      *       0.0.0.0/0            0.0.0.0/0            MARK xor 0x4000
    2   120 MASQUERADE  all  --  *      *       0.0.0.0/0            0.0.0.0/0            /* kubernetes service traffic requiring SNAT */ random-fully

Chain KUBE-PROXY-CANARY (0 references)
 pkts bytes target     prot opt in     out     source               destination         

Chain KUBE-SEP-6E7XQMQ4RAYOWTTM (1 references)
 pkts bytes target     prot opt in     out     source               destination         
    0     0 KUBE-MARK-MASQ  all  --  *      *       10.244.0.3           0.0.0.0/0            /* kube-system/kube-dns:dns */
    0     0 DNAT       udp  --  *      *       0.0.0.0/0            0.0.0.0/0            /* kube-system/kube-dns:dns */ udp to:10.244.0.3:53

Chain KUBE-SEP-IT2ZTR26TO4XFPTO (1 references)
 pkts bytes target     prot opt in     out     source               destination         
    0     0 KUBE-MARK-MASQ  all  --  *      *       10.244.0.2           0.0.0.0/0            /* kube-system/kube-dns:dns-tcp */
    0     0 DNAT       tcp  --  *      *       0.0.0.0/0            0.0.0.0/0            /* kube-system/kube-dns:dns-tcp */ tcp to:10.244.0.2:53

Chain KUBE-SEP-N4G2XR5TDX7PQE7P (1 references)
 pkts bytes target     prot opt in     out     source               destination         
    0     0 KUBE-MARK-MASQ  all  --  *      *       10.244.0.2           0.0.0.0/0            /* kube-system/kube-dns:metrics */
    0     0 DNAT       tcp  --  *      *       0.0.0.0/0            0.0.0.0/0            /* kube-system/kube-dns:metrics */ tcp to:10.244.0.2:9153

Chain KUBE-SEP-V2PECCYPB6X2GSCW (1 references)
 pkts bytes target     prot opt in     out     source               destination         
    2   120 KUBE-MARK-MASQ  all  --  *      *       172.18.0.2           0.0.0.0/0            /* default/kubernetes:https */
    8   480 DNAT       tcp  --  *      *       0.0.0.0/0            0.0.0.0/0            /* default/kubernetes:https */ tcp to:172.18.0.2:6443

Chain KUBE-SEP-YIL6JZP7A3QYXJU2 (1 references)
 pkts bytes target     prot opt in     out     source               destination         
    0     0 KUBE-MARK-MASQ  all  --  *      *       10.244.0.2           0.0.0.0/0            /* kube-system/kube-dns:dns */
    0     0 DNAT       udp  --  *      *       0.0.0.0/0            0.0.0.0/0            /* kube-system/kube-dns:dns */ udp to:10.244.0.2:53

Chain KUBE-SEP-ZP3FB6NMPNCO4VBJ (1 references)
 pkts bytes target     prot opt in     out     source               destination         
    0     0 KUBE-MARK-MASQ  all  --  *      *       10.244.0.3           0.0.0.0/0            /* kube-system/kube-dns:metrics */
    0     0 DNAT       tcp  --  *      *       0.0.0.0/0            0.0.0.0/0            /* kube-system/kube-dns:metrics */ tcp to:10.244.0.3:9153

Chain KUBE-SEP-ZXMNUKOKXUTL2MK2 (1 references)
 pkts bytes target     prot opt in     out     source               destination         
    0     0 KUBE-MARK-MASQ  all  --  *      *       10.244.0.3           0.0.0.0/0            /* kube-system/kube-dns:dns-tcp */
    0     0 DNAT       tcp  --  *      *       0.0.0.0/0            0.0.0.0/0            /* kube-system/kube-dns:dns-tcp */ tcp to:10.244.0.3:53

Chain KUBE-SERVICES (2 references)
 pkts bytes target     prot opt in     out     source               destination         
    2   120 KUBE-MARK-MASQ  tcp  --  *      *      !10.244.0.0/16        10.96.0.1            /* default/kubernetes:https cluster IP */ tcp dpt:443
    8   480 KUBE-SVC-NPX46M4PTMTKRN6Y  tcp  --  *      *       0.0.0.0/0            10.96.0.1            /* default/kubernetes:https cluster IP */ tcp dpt:443
    0     0 KUBE-MARK-MASQ  tcp  --  *      *      !10.244.0.0/16        10.96.0.10           /* kube-system/kube-dns:dns-tcp cluster IP */ tcp dpt:53
    0     0 KUBE-SVC-ERIFXISQEP7F7OF4  tcp  --  *      *       0.0.0.0/0            10.96.0.10           /* kube-system/kube-dns:dns-tcp cluster IP */ tcp dpt:53
    0     0 KUBE-MARK-MASQ  tcp  --  *      *      !10.244.0.0/16        10.96.0.10           /* kube-system/kube-dns:metrics cluster IP */ tcp dpt:9153
    0     0 KUBE-SVC-JD5MR3NA4I4DYORP  tcp  --  *      *       0.0.0.0/0            10.96.0.10           /* kube-system/kube-dns:metrics cluster IP */ tcp dpt:9153
    0     0 KUBE-MARK-MASQ  udp  --  *      *      !10.244.0.0/16        10.96.0.10           /* kube-system/kube-dns:dns cluster IP */ udp dpt:53
    0     0 KUBE-SVC-TCOU7JCQXEZGVUNU  udp  --  *      *       0.0.0.0/0            10.96.0.10           /* kube-system/kube-dns:dns cluster IP */ udp dpt:53
 2237  134K KUBE-NODEPORTS  all  --  *      *       0.0.0.0/0            0.0.0.0/0            /* kubernetes service nodeports; NOTE: this must be the last rule in this chain */ ADDRTYPE match dst-type LOCAL

Chain KUBE-SVC-ERIFXISQEP7F7OF4 (1 references)
 pkts bytes target     prot opt in     out     source               destination         
    0     0 KUBE-SEP-IT2ZTR26TO4XFPTO  all  --  *      *       0.0.0.0/0            0.0.0.0/0            /* kube-system/kube-dns:dns-tcp */ statistic mode random probability 0.50000000000
    0     0 KUBE-SEP-ZXMNUKOKXUTL2MK2  all  --  *      *       0.0.0.0/0            0.0.0.0/0            /* kube-system/kube-dns:dns-tcp */

Chain KUBE-SVC-JD5MR3NA4I4DYORP (1 references)
 pkts bytes target     prot opt in     out     source               destination         
    0     0 KUBE-SEP-N4G2XR5TDX7PQE7P  all  --  *      *       0.0.0.0/0            0.0.0.0/0            /* kube-system/kube-dns:metrics */ statistic mode random probability 0.50000000000
    0     0 KUBE-SEP-ZP3FB6NMPNCO4VBJ  all  --  *      *       0.0.0.0/0            0.0.0.0/0            /* kube-system/kube-dns:metrics */

Chain KUBE-SVC-NPX46M4PTMTKRN6Y (1 references)
 pkts bytes target     prot opt in     out     source               destination         
    8   480 KUBE-SEP-V2PECCYPB6X2GSCW  all  --  *      *       0.0.0.0/0            0.0.0.0/0            /* default/kubernetes:https */

Chain KUBE-SVC-TCOU7JCQXEZGVUNU (1 references)
 pkts bytes target     prot opt in     out     source               destination         
    0     0 KUBE-SEP-YIL6JZP7A3QYXJU2  all  --  *      *       0.0.0.0/0            0.0.0.0/0            /* kube-system/kube-dns:dns */ statistic mode random probability 0.50000000000
    0     0 KUBE-SEP-6E7XQMQ4RAYOWTTM  all  --  *      *       0.0.0.0/0            0.0.0.0/0            /* kube-system/kube-dns:dns */

**Comment by mhines01** [comment]
marcus@muerto:~/go/src/github.com/google/kne/kne_cli$ kubectl exec -it foo -- /bin/bash
root@foo:/# tcpdump -i eth0
tcpdump: verbose output suppressed, use -v or -vv for full protocol decode
listening on eth0, link-type EN10MB (Ethernet), capture size 262144 bytes
^Z
[1]+  Stopped                 tcpdump -i eth0
root@foo:/# bg
[1]+ tcpdump -i eth0 &
root@foo:/# telnet 10.96.0.1 443 
Trying 10.96.0.1...
Connected to 10.96.0.1.
Escape character is '^]'.
23:19:07.295835 IP foo.53990 > kubernetes.default.svc.cluster.local.https: Flags [S], seq 326820212, win 64240, options [mss 1460,sackOK,TS val 4070065789 ecr 0,nop,wscale 7], length 0
23:19:07.295867 IP kubernetes.default.svc.cluster.local.https > foo.53990: Flags [S.], seq 747928038, ack 326820213, win 65160, options [mss 1460,sackOK,TS val 2056639452 ecr 4070065789,nop,wscale 7], length 0
23:19:07.295873 IP foo.53990 > kubernetes.default.svc.cluster.local.https: Flags [.], ack 1, win 502, options [nop,nop,TS val 4070065789 ecr 2056639452], length 0
23:19:07.296096 IP foo.50922 > kube-dns.kube-system.svc.cluster.local.domain: 42034+ PTR? 1.0.96.10.in-addr.arpa. (40)
23:19:07.296306 IP kube-dns.kube-system.svc.cluster.local.domain > foo.50922: 42034*- 1/0/0 PTR kubernetes.default.svc.cluster.local. (112)
23:19:07.296428 IP foo.50978 > kube-dns.kube-system.svc.cluster.local.domain: 9454+ PTR? 10.0.96.10.in-addr.arpa. (41)
23:19:07.296557 IP kube-dns.kube-system.svc.cluster.local.domain > foo.50978: 9454*- 1/0/0 PTR kube-dns.kube-system.svc.cluster.local. (116)
^]
telnet> quit
Connection closed.
23:19:10.715392 IP foo.53990 > kubernetes.default.svc.cluster.local.https: Flags [F.], seq 1, ack 1, win 502, options [nop,nop,TS val 4070069209 ecr 2056639452], length 0
23:19:10.715520 IP kubernetes.default.svc.cluster.local.https > foo.53990: Flags [F.], seq 1, ack 2, win 510, options [nop,nop,TS val 2056642872 ecr 4070069209], length 0
23:19:10.715536 IP foo.53990 > kubernetes.default.svc.cluster.local.https: Flags [.], ack 2, win 502, options [nop,nop,TS val 4070069209 ecr 2056642872], length 0
root@foo:/# fg
tcpdump -i eth0
^C
10 packets captured
10 packets received by filter
0 packets dropped by kernel

**Comment by mhines01** [comment]
marcus@muerto:~/go/src/github.com/google/kne/kne_cli$ kubectl exec -it bar -- /bin/bash
root@bar:/# tcpdump -i eth0
tcpdump: verbose output suppressed, use -v or -vv for full protocol decode
listening on eth0, link-type EN10MB (Ethernet), capture size 262144 bytes
^Z
[1]+  Stopped                 tcpdump -i eth0
root@bar:/# bg
[1]+ tcpdump -i eth0 &
root@bar:/# telnet 10.96.0.1 443
Trying 10.96.0.1...
telnet: Unable to connect to remote host: No route to host
root@bar:/# ip23:20:01.108362 ARP, Request who-has 10.244.0.1 tell bar, length 28
23:20:02.141195 ARP, Request who-has 10.244.0.1 tell bar, length 28
23:20:03.181256 ARP, Request who-has 10.244.0.1 tell bar, length 28
23:20:04.221246 ARP, Request who-has 10.244.0.1 tell bar, length 28
23:20:05.261199 ARP, Request who-has 10.244.0.1 tell bar, length 28
23:20:06.301214 ARP, Request who-has 10.244.0.1 tell bar, length 28
 r^C
root@bar:/#

**Comment by marcushines** [comment]
problem traced to this

https://github.com/networkop/meshnet-cni/issues/28
